{
  "schema_version": 1,
  "id": "CHECKPOINT-0001",
  "task_id": "TASK-0001",
  "stage_id": "STAGE-0001",
  "state_revision": 3,
  "writer_lease_id": "LEASE-0001",
  "completed_steps": ["Created pyproject.toml"],
  "in_progress_steps": ["Writing CLI"],
  "changed_files": ["pyproject.toml"],
  "check_summaries": [{"id": "PYTHON_VERSION", "exit_code": 0, "status": "pass", "summary": "OK"}],
  "known_risks": [],
  "source_fingerprint": {
    "git_head": "abc123",
    "staged_diff_sha256": null,
    "unstaged_diff_sha256": null,
    "untracked_files": [],
    "captured_at": "2026-07-17T14:00:00+08:00"
  },
  "created_at": "2026-07-17T14:00:00+08:00"
}
